,Sentences
202,We see market share growth in HUGO BOSS and Marc Jacobs Daisy and several other brands
203,"So overall, our portfolio both in terms of the classic pillars in Luxury and, but also in the innovation it brings to market, that includes philosophy, is performing quite well and, of course, that gives us confidence"
204,"When I look at Professional Beauty, the growth that we're having in hair, which is one of the two category that we work in Professional Beauty, is actually positive"
205,And it has been positive now for several quarters
206,And this is the bulk of our business
207,"This is where we believe we are growing market share, especially in color, which is the core part of Wella Professional"
208,"And we expect to have this positive momentum and performance to continue because of the strength of our brands, but also the strength of the capabilities that we have in the professional business, in the professional service business"
209,"And regarding Consumer Beauty, it's really, first of all, there are some spring and some excellent results that we're seeing in, especially in ALMEA"
210,"And so, I mentioned Mexico, Australia, Brazil, but we have also some other, Bourjois continues to grow market share both in Europe, but also in Russia, Middle East"
211,We have Rimmel having market share growth in several countries
212,"So, there are several examples that clearly gives us this confidence of improving trends"
213,"But as I said, Consumer Beauty will take time before a full recovery"
214,"This is, clearly, the largest division we have"
215,We have faced some challenges
216,We continue to face some challenges and that's why we're going to continue to implement all our actions to implement the recovery
217,"So, Jonathan, Younique is clearly an acquisition, a very strategic acquisition that we are very pleased with, and it continues to grow double digits"
218,"So, the performance that we mentioned at the time of the acquisition continues to be true now that it's clearly under the partnership with us"
219,"In terms of additional KPIs that you ask, there is one that is very telling, which is the sign-ups, so the basic recruitment of presenters"
220,"And right now, we are approaching 100,000 presenters totally, overall, with over 100,000 presenters that joined us in Q1 2018 alone"
221,"So, I guess, I think combining the net revenue, double-digit growth and the growth of the presenters, that clearly makes us satisfied with the performance"
222,"In terms of the role that direct selling can play within Coty, I think that we have made what I would call a very strategic and successful acquisition with Younique"
223,"We are very satisfied with it, and I believe direct selling has clearly a role to play within Coty given the growing size of Younique"
224,"But the other reason why I believe that this is so relevant is because of the direct link between the presenters and the consumers, and this is very, very relevant in the current market where individualized and customized approach to consumers is a big trend"
225,"And having a 100,000 presenters who are our brand ambassadors, who talk to millions of consumers out there on a daily basis, almost on an individual basis, because sometimes they do virtual parties with few people, but most of the time is individual basis, to me is also key to the performance that we're seeing in Younique"
