"Thanks, Laura"
A lot of that has to do with the currency and the currency shifts having an impact on GP rate
And so we are working through pricing changes as a result of that
"But when that happens typically, we like that and so we have to make that up"
We’re also working on the plans to get back to where we need to be starting in 2018. So it’s not a permanent change
It’s just a pretty significant change given the currency translation
So thanks for joining us this morning
"Just to reiterate, we performed as we expected during the quarter"
"I think, the exciting points are that we’re starting to see growth in places that are really important for a long-term profitability, most notably midsized customers and large customers stop buy"
"We are continuing to make the portfolio stronger, making sure that the businesses we have are profitable and have profitable growth"
"Our actions in Canada, we are taking an eye towards improving profitability much faster there and took some significant actions in the quarter"
We’ll keep talking about what we’re doing there
And we really believe that we are very well positioned to improve the customer experience
The conversations we have with customers around pricing have been fantastic
There has been no walking by customers
They’re very happy with what the direction we’re taking
They understand that we have a great service
They understand that we have a strong digital experience
They understand that we have a strong onsite experience
We’re going to continue to leverage those things to grow the business and we’re really excited about the path we’re on
"So with that, thanks for joining us and take care"
