,Sentences
0,"Thank you, Jacquie, and good afternoon, everyone"
1,I'm pleased to report the Illumina team delivered a strong third quarter with revenue growing 18% year-over-year to $714 million
2,"With solid results across our portfolio, it is clear that Illumina is both enabling and accelerating the global adoption of sequencing applications"
3,"At Illumina, our mission is to improve human health by unlocking the power of the genome, and our commitment to innovation, while clear across our portfolio, is most recently demonstrated with the launch of the NovaSeq system"
4,"We believe NovaSeq is a transformative platform that enables existing sequencing customers to increase output and lower costs while, at the same time, lowering the barriers for new-to-sequencing customers"
5,"Ultimately, our goal is to unlock the benefits of sequencing for as many people as possible"
6,"With that in mind, we are very pleased with NovaSeq's performance since its launch in early January"
7,"In total, we have shipped approximately 200 systems in the first three quarters of 2017, including more than 80 in the third quarter"
8,"As expected, NovaSeq's shipments increased sequentially from last quarter, with shipments no longer constrained by manufacturing capacity"
9,"With approximately 70 orders in the quarter, we ended Q3 with a backlog of more than 100 systems"
10,"Going forward and as expected, backlog should start to trend downwards now that manufacturing constraints are behind us"
11,"Overall, we are currently on track to significantly exceed the 2017 forecast we targeted at launch"
12,"As expected, most of our third quarter NovaSeq orders came from existing HiSeq customers"
13,"We are seeing robust demand from HiSeq customers upgrading their infrastructure, and are still in the early stages of the upgrade wave"
14,"We remain confident that most of our 800 HiSeq customers will upgrade to NovaSeq to access its power, improved work flow and lower sequencing costs, especially with the introduction of the S4 and S1 flow cells"
15,"Additionally, NextSeq will continue to be the go-to platform for a subset of HiSeq customers"
16,Moving to HiSeq X
17,Many of our HiSeq X customers have ordered their first NovaSeqs to start validations in new projects
18,It's worth noting that these very high volume customers will generally align their fleet transitions with the completion of existing projects
19,"As a result, we expect to continue to see strong NovaSeq uptake through the fourth quarter of 2017 into 2018 and beyond"
20,"Additionally, we are seeing continued signs of elasticity with about one-third of NovaSeq orders in Q3 coming from new-to-Illumina sequencing are previously benchtop-only customers"
21,"Examples include a children's hospital in North America that has purchased a NovaSeq to bring sequencing in-house, and an existing MiSeq and NextSeq customer that is moving to NovaSeq to begin providing exome sequencing and liquid biopsy tests"
22,"We also saw a growing multi-unit NextSeq customer that is moving to NovaSeq to leverage the increased throughput on a system that occupies a smaller footprint overall, requires less FTE time and offers a lower cost per sample"
23,We therefore believe we are still in the earliest stages of a multiyear adoption cycle that extends well beyond our HiSeq customer population
24,"Moving to sequencing consumables, we continue to see strong adoption with growth of 14% year-over-year to $380 million"
25,The $42 million sequential growth in sequencing consumables represents the largest ever sequential dollar increase in our sequencing consumable business
26,"This was driven by growth in our installed base and strong NextSeq utilization, in addition to stronger-than-expected HiSeq consumables"
27,HiSeq consumables increased sequentially driven by a few of our large clinical commercial customers who are seeing growing sample volume
28,"Excluding this group of customers, HiSeq consumables declined"
29,Our expectation remains that HiSeq consumables will trend lower going forward given the transition to NovaSeq and NextSeq
30,"As expected, we saw a slight sequential pickup in HiSeq X consumables driven by translational studies and growth in China"
31,"With the S4 flow cell now broadly available, we expect HiSeq X consumables to follow a similar trend to HiSeq consumables, with the decline to begin sometime in the coming quarters"
32,"Moving to our benchtop portfolio, system shipments were essentially flat from the second quarter"
33,"Our win rates remain stable and new-to-sequencing customers represented over half of NextSeq, MiniSeq and MiSeq placements"
34,"Utilization was within each benchtop instrument's respective guidance range, except for a record NextSeq performance that exceeded the upper end of our range and was once again driven by production clinical customers"
35,"In terms of new product launches, we delivered the new S4 flow cell to early-access customers as expected"
36,I'm pleased to share that feedback on initial runs at seven customer sites have been very positive with performance exceeding specifications
37,"Building on the S2 flow cell, the new S4 flow cell enables a lower price per sample compared to HiSeq X for customers in our highest tiers of utilization and is therefore ideally suited for high-intensity sequencing applications"
38,S4 is now commercially available
39,We are also gearing up for the release of the NovaSeq Xp workflow and reagents
40,This is the individually addressable lane workflow that we first announced back in April
41,"The device enables libraries to be loaded directly into each lane of the flow cell allowing customers to partition different libraries, projects, samples and applications"
42,"We expect to begin beta testing in the coming weeks, ahead of a full commercial release expected before the end of the year"
43,"The next flow cell we're working to add to the portfolio is the S1, which we now expect to bring to the market in the first quarter of 2018."
44,The S1 is the lowest output flow cell for NovaSeq at 1 terabase per run or 500 gigabases per flow cell
45,"This is expected to be a very attractive upgrade option for HiSeq 2500 customers, including those who utilize the rapid run option"
46,"The addition of S1 will nicely round out our flow cell portfolio, which can now accommodate data yields of between 500 gigabases and 6 terabases"
47,We have suspended plans for an S3 flow cell with an output of 4 terabases given strong customer preference to use S4 for high-output applications and either S1 or S2 for lower-output applications
48,"You may also recall that we had plans for a lower output and marginally lower cost NovaSeq system, the 5000, to run just the S1 and S2 flow cells"
49,"Based on customer feedback and our experience over the last three quarters, we believe that the existing 6000 fully meets all customer needs in addition to enable greater flexibility to scale in the future without an additional capital purchase"
50,"Consistent with our broader objective to streamline our product portfolio, we have therefore decided not to launch the NovaSeq 5000, instead focusing on the 6000."
51,"At Illumina, we strongly believe that sequencing offers the promise to transform lives and are encouraged to see sequencing continue its progress into clinical application"
52,"In the third quarter, shipments to our clinical customers grew 35%, largely driven by our liquid biopsy customers"
53,"More specifically, oncology testing shipment growth accelerated from last quarter"
54,"The FDA's approval of KYMRIAH as the first immune cell therapy is, of course, a very exciting development for the field of oncology, opening a whole new world of possibility for gene and cell therapies"
55,"Sequencing is an important enabler in the discovery of immunotherapies, and with approximately 1,000 immuno-oncology drugs and clinical trials in the U.S"
56,"alone, Illumina is committed to supporting our customers as they endeavor to deliver new hope to cancer patients and their families"
57,"Another important area for Illumina is rare and undiagnosed diseases, where patients, including newborns and their families, can find themselves on a multi-year odyssey searching for a diagnosis"
58,"There are more than 7,000 genetic disorders that aren't well known enough to be routinely identified by physicians, but that can now be identified by genomic analysis"
59,The right diagnosis can reduce pain and enable earlier and potentially life-impacting or life-saving therapies
60,"It was, therefore, great to see UnitedHealthcare's recent decision to cover whole exome sequencing for the diagnosis or evaluation of genetic disorders in patients and their parents and siblings"
61,"Starting on November 1, UnitedHealthcare will cover whole exome sequencing for patients where clinical presentation is nonspecific and does not fit a well-defined syndrome for which a specific or targeted gene test is available"
62,"Once the UnitedHealthcare decision takes effect next week, more than 100 million lives will be covered for whole exome sequencing for rare and undiagnosed diseases in the U.S"
63,This compares to almost none a year ago
64,"Finally, in its first full quarter of availability following the CE-IVD release, our VeriSeq NIPT CE-IVD solution delivered another strong quarter, with the number of shipped samples and revenue almost doubling sequentially"
65,The product is performing well in competitive tenders and we added a sizable German customer during the quarter that will start ramping around the end of the year
66,"Moving back to the quarter, microarray revenue grew 27% to $121 million with continued momentum among our direct-to-consumer customers"
67,"Helix formally launched in July, creating a completely new marketplace for emerging consumer genomics"
68,"During the quarter, they added six new apps from four new partners, bringing the total number of products available to 26."
69,"At the same time, Helix is exploring new commercial avenues with a selection of products now available on amazon"
70,com and has teamed up with Illumina Accelerator to support innovative start-up companies working to create breakthrough DNA-driven products for consumers
71,"Before I hand the call over to Sam, I want to share with you a change in one of our leadership roles"
72,"I'm happy to announce that Marc Stapley has accepted the role of EVP of Strategy and Corporate Development responsible for corporate strategy, corporate and business development, government affairs and global infrastructure, including IT and facilities"
73,"Marc has been an invaluable partner to me as Chief Administrative Officer and has hired some exceptional leaders, while helping our G&A functions develop in scale"
74,"As a result of the change, our CFO, Sam Samad; General Council, Chuck Dadswell; and the new Chief People Officer, when hired, will report directly to me"
75,"I'm looking forward to have Marc now focus on driving our strategy process and getting more deeply involved in key transactions, including our population sequencing efforts"
76,"Finally, I'll highlight that Illumina Ventures raised $230 million for its first genomics-focused fund"
77,"To-date, Illumina Ventures has made investments in seven early-stage companies in industries ranging from novel therapeutics, diagnostics and research tools to food security and synthetic biology"
78,"With that, I'll hand the call over to Sam for a review of our quarterly financials"
79,Sam?
80,"Hi, Derik"
81,How are you?
82,It's a modest delay and the team prioritized in this quarter of getting the Xp workflow and the S4 flow cell out
83,"And so, that continues"
84,And the team is currently working on it optimizing the S1 chemistries
85,"And so, we expect that to come out in Q1."
86,Yeah
87,"So, for now, two quarters in a row, we've seen a good demand, a healthy demand, come from new to Illumina sequencing as well as benchtop only, and we've talked about the fact that it was about one-third of orders that came in for NovaSeq in these two quarters coming from that segment"
88,"The majority, therefore, and just do the math, the majority did come from typically HiSeq customers and HiSeq X customers"
89,We are definitely seeing the beginning of the HiSeq upgrade wave
90,"In the last quarter, we talked about the fact that about 10% or just over 10% of the HiSeq customers have bought NovaSeqs"
91,We obviously added to that number in this quarter
92,And we're starting to see X customers buy and validate their first NovaSeqs and start to think about the fleet replatforming
93,"Now that we've put S4 out, we expect to see more of those happening in the coming quarters"
94,"And so, we expect to see more multi-unit orders come in now that we've put S4 out there"
95,"In terms of the 5000 and the 6000, as you'll recall, Tycho, typically, we do have sort of a lighter end version of most instruments we put out, right?"
96,"So, we had the HiSeq 3000 and the 4000."
97,"We had the NextSeq 500 and the 550, and we fully expected that that would be the dynamic here with NovaSeq as well"
98,"And what we found from talking to customers and our field force really sort of amplified that feedback back to the leadership team, is that in this case, there was a lot of demand for the 6000, so for the next platform to be the 6000 for our high throughput customers"
99,And there weren't a lot of customers asking for and certainly not waiting for the 5000.
100,"And so, what's playing out right now is that the choice our customers are having is if they want a high throughput instrument, they're looking at the 6000."
101,"Otherwise, they're looking at the NextSeq"
102,"And so, as we think about the upgrade opportunity for HiSeqs, we expect the majority of them will go to NovaSeqs, but then, there'll be a number of them that opt to get one or more NextSeqs instead"
103,"We haven't broken it out, but certainly, some of the anecdotal feedback I can share is that we're seeing sort of all of the above right now"
104,We are seeing customers that are new to sequencing getting into the game and are looking to do whole exomes or whole genomes
105,"An example of that would be a new to sequencing customer that we got out of the Middle East that bought NovaSeq to participate in the second phase of the Saudi whole genome project, for example, or the hospital that I talked about in North America that previously didn't do any of their sequencing in-house, and now, bought a NovaSeq so that they don't have to outsource the sequencing that they do"
106,"We're seeing a customer out in Greater China, for example, that purchased NovaSeqs to support their collaboration with a genome alliance in that region"
107,"In that case, there was genomes"
108,"And then, we talked about what's playing out with rugged, rare and undiagnosed diseases, where there's reimbursement now for whole exome trio sequencing"
109,"And so, hospitals that look to provide that will be looking at potentially NovaSeqs to do exomes"
110,"And so, at this point, it's too early to break it out specifically, but we're seeing all of the above"
111,We're seeing people getting into from panels to exomes
112,"We're seeing exomes to genomes, new to genomes"
113,"And then, we talked about demand coming from oncology applications, like liquid biopsy"
114,"Hi, Bill"
115,Yeah
116,"And what I share with you will be again anecdotal, but certainly, the economics makes sense for the X customers to really excite about the S4 in a way that frankly, the other flow cells aren't as exciting to them"
117,"And so, if you look at how the conversations are playing out with some of our HiSeq X customers, some of them did purchase NovaSeqs"
118,"But there are more NovaSeqs so they can get familiar with the instrument and the platform, understand the workflow, understand the differences"
119,"But for the majority of the HiSeq X customers, moving the fleet over to NovaSeq really makes sense once the S4 is out, and that's how this market's playing out"
120,"In some cases, the HiSeq X customers waited for the S4 to get into NovaSeq at all"
121,"And in other cases, they got in but are looking at the S4 as the enablement that they were waiting for to move their fleets over"
122,It's still too early for us to talk about the contribution that Helix will have
123,"They announced, they launched last quarter, so only a few months post their launch"
124,"And so, they're still in their ramp-up phase"
125,"I think sometime over the course of the next year, it'll make more sense for us to give you more details on that business, but again, it's too early right now"
126,Let me take a cut at the answers
127,"So, the $42 million sequential consumable growth was driven by growth across all of our platforms"
128,"So if you look at every single one of our platforms, we saw sequential growth in sequencing consumables"
129,"But, obviously, the growth wasn't equal"
130,"So if you look at the high throughput part of our portfolio, the biggest part of the growth in that part of the portfolio came from NovaSeq"
131,"And so, that was the biggest contributor on the high throughput part of the portfolio to the sequential sequencing consumable growth that we saw"
132,"On the benchtop side, again, although every platform grew, the biggest contributor to that growth was NextSeq, and so â€"
133,“ but all our platforms grew
134,It was really NovaSeq and NextSeq that were the big drivers of the consumables growth that you â€
135,“ sequencing consumables growth that you saw sequentially
136,"In terms of will NovaSeq lead to labs spending more in consumables, we are at the stage where we can share some anecdotal feedback"
137,"And what we are hearing is that certainly with S4, there are applications, there are samples that become accessible at the price points that S4 affords"
138,That will lead over time to labs being able to access additional funding and drive more consumable spend
139,We're at the beginning of that obviously with S4 coming out and giving customers access to price points for those large-scale projects that they didn't have before
140,"And so, we are encouraged by seeing a lot of new customers come in to buy NovaSeq because they believe that thesis"
141,"What's still in front of us, then, is to see that pull-through show up in NovaSeq consumables, but the early indicators in terms of people buying instruments, in terms of new customers coming in, is very positive"
142,And I actually didn't capture the third question
143,Yeah
144,"So, let's talk about both the trade-in and the decommissioning"
145,Our conversations aren't really driven as much by the utilization rates
146,What we're finding is it's driven by what customers expect in terms of their business plans going forward
147,"And so, again, some of them are new that didn't have the history but are getting into NovaSeqs"
148,"and it's based on a business plan that they see accessible to them now, whether it's the new customer we have that decided to get into the whole exome, whole genome sequencing servicing market"
149,"And so, it's much more driven by business plans going forward rather than the utilization rate by far (35:30)"
150,There's some overlap between the two
151,but it's not a perfect overlap there
152,"In terms of decommission, just for the numbers, we removed approximately 23 instruments from the HiSeq installed base and we did not decommission any Xs from the installed base"
153,"At this point, we're not talking about the specific volumes because we've moved away from reporting those volumes, so we don't have that to share with you"
154,"What we are sharing is the market dynamic,"
155,right?
156,"And so, from a market dynamic perspective, we continue to be very encouraged by the progress we are seeing in terms of NIPT reimbursement, both in the United States where we're now at 39% of the population, about 150 million lives that are covered for an NIPT testing"
157,"And then, the progress we're seeing in Europe have some countries that are covering NIPT testing for the entire population"
158,"And so, we see that happening in the Netherlands, for example, in Belgium, and then, countries like England and France where we're starting to see parts of the population getting covered"
159,"So, we continue to see progress in terms of people having access to the test, which is then driving the sample volume growth that we talked about and that obviously will then drive revenue growth"
160,Yeah
161,"I mean, there are a number of areas that are emerging that we're excited about"
162,We're excited about the whole area of single cell research
163,"We think that is a new research paradigm that is driving a lot of very exciting projects to understand the differential expression across cell types, even in a single tissue"
164,"We're excited about the research that's happening and this is more commercially oriented, but in immune-oncology, for example, we think that that's driving some very exciting research"
165,I'm never going to be on the side of arguing against Bill Gates
166,"And in this case, I actually agree that metagenomics is also a very promising and exciting area and for genomics, in addition to proteomics"
167,"So, I think that's an interesting area, too, and has, in the long term, some really exciting potential"
168,We continue to see demand growing over the long term from that segment
169,"We talked about the fact specifically, for example, that sequencing is a core tool in immuno-oncology and immunotherapies"
170,"And so, that area continues to be an exciting one that we are watching that holds promise, not just for us but for patients as well"
171,"And so, we see them as a growing part of our business"
172,and I expect that'll continue to be so for a long time
173,Yeah
174,"So, I'll start by saying that â€“ and we said this this quarter, we said this last quarter, that we are very pleased with how NovaSeq is performing, and it is on track to exceed the full-year plan we had for NovaSeq coming into this year and exceeded comfortably"
175,"So overall, we are very pleased with how it's playing out in the market"
176,"We continue to believe that in the long term, the vast majority of our HiSeq customers will upgrade and most of them will move to NovaSeq"
177,"Now, we expect some of them to move to NextSeq and that's good for us, too, but we do expect that most of them will move to NovaSeq"
178,"The one-third new to sequencing is incremental, obviously, to the upgrade wave that we are looking at"
179,And that's encouraging to see it play out the way it's playing out now for two quarters in a row
180,"So overall, I'd say we are very happy"
181,We are exceeding our plan for the year
182,"We do believe, we continue to believe, though, that this is a multi-year upgrade path"
183,"So coming into the year, we thought it was a three to five-year upgrade wave"
184,and we continue to believe that
185,We definitely believe that NovaSeq will enable new types of sequencing to be done on a number of fronts
186,"So, NovaSeq fundamentally enables larger experiments, larger cohorts"
187,"And that could be at the macro scale, so population sequencing efforts I think are more accessible to more customers than they were before because of NovaSeq"
188,But also at the micro scale
189,"So we expect to see, and we are seeing, lots of exciting single-cell projects being contemplated because of the economics and the power of NovaSeq"
190,"And so we expect, on the one hand, NovaSeq will enable access to larger cohorts at every scale in a way that hasn't been done before"
191,"We also expect and we're seeing that, even with the same size of cohorts, we're seeing a lot of sequencing intensive applications being done more"
192,So the growth in liquid biopsy is enabled by people having access and more customers having access to more power at lower costs
193,And that's what NovaSeq does
194,"So the liquid biopsy market, I think, is accelerated by something like NovaSeq"
195,"We will, we believe, continue to see the movement from single-gene panels to multi-gene panels to exomes to genomes, right?"
196,"And actually, interestingly enough, I think the recent PAMA decision also helps that where there's the reimbursement framework starting to be set for the larger multi-gene panels"
197,But I do think you'll start to see this migration to doing bigger panels and then doing exomes and doing genomes
198,"And we're starting to see that, but it's early in that journey"
199,"But over the course of multiple years, we all know you do better science; you get higher diagnostic yield as you move up that continuum"
200,And NovaSeq is helpful in that dimension
201,"And then the applications that require sort of needle in a haystack type work, and that's again like liquid biopsy where you need to do very, very, very deep sequencing to find the rare event,"
202,the rare molecule
203,And there's a set of those applications that can now be enabled with the power of NovaSeq
204,"And so, on a multiyear horizon, we do believe that NovaSeq fundamentally enables new types of sequencing at the cohorts, larger cohort scale, but also at the more intense, deeper sequencing scale"
205,"I think on sort of both categories, I think if you look at the â€“ on the screening side, there are a number of companies now that have been resourced and financed to look into that market"
206,So it's not just GRAIL anymore
207,"And in aggregate, I think that's additive to our business as a whole"
208,And it's sort of a positive
209,We've talked before about the fact that GRAIL had the potential to be among our biggest customers
210,"And to the extent that you have more companies that are doing sequencing intensive applications in very large-scale studies like that, having more customers that show up among our biggest customers is definitely good for our business"
