,Sentences
211,That will probably play out over time and unclear to say what the actual overall impact in 2018 will be
212,But that is a very healthy dynamic in general
213,"Similarly, if you look for later stage, whether it's therapy selection or monitoring, again, that brings NGS into segments of oncology where there was no NGS before"
214,And oncology remains one of the big market opportunities where NGS can really make a difference
215,"And so I think it's all incremental in terms of driving our penetration into oncology, and that remains a very big opportunity, we believe"
216,Sure
217,"We did anticipate coming into the year that, as we launch NovaSeq, you would see some destocking, and that's what played out in Q1."
218,"And if you look at it, it's primarily the handful of X customers potentially that we felt would destock as they looked at NovaSeq"
219,"If I look at the consumable growth, the sequencing consumable growth that we saw in Q3, it was across the board, across every platform that we had"
220,"And so I think when we started to break down, okay, could the destocking have played a factor here?"
221,It certainly could have and it likely did probably maybe in one of those platforms
222,I think for HiSeq X
223,"it's possible, for example, or HiSeq"
224,"But if you look across the board, I said we saw sequencing consumable growth across every single platform"
225,"And the story, there are stories around each segment of the market and why that's growing"
226,"For example, we continue to see our clinical commercial customers grow, and that's driven by growth in samples in the markets that they're addressing, whether that's in oncology or in NIPT, and that's starting to flow through, for example, in NextSeq or in MiSeq"
227,or it could be some in HiSeq
228,"And so what's happening is, across the board, we're seeing demand grow"
229,And that's starting to show up across our different platforms
230,"In X and in NovaSeq, you're starting to see the dynamic of NovaSeq is ramping up"
231,And so there's a little bit potentially of the destocking that's playing out in that part of the market
232,"But again, I think across the board, what we're seeing with our customers is they are seeing demand, and that's driving them spending more on consumables"
233,It's definitely been a good growth story for us and there are a number of drivers from it
234,A big driver obviously has been the direct-to-consumer market
235,Those customers have continued to exceed their own plans for growth
236,And that then translated into the demand that you're seeing from us
237,"But there are other segments that are playing out, too"
238,"For example, agriculture is a very interesting segment and continues to drive demand for our microarray products"
239,We expect to see the demand continue to grow from their customers' perspective
240,"You talk to ag customers, they're looking to expand either the types of species that they're looking to sequence"
241,They're looking to actually expand the production sequencing that they do
242,"If you talk to our DTC customers, they believe that they are still in the very early stages of this big consumer genomics market"
243,"And so, from a demand perspective, our customers will tell us that if you look out into the horizon, they expect demand to continue to grow and that we're at the very early stages of those markets"
244,"We're also, though, talking to them about moving to sequencing"
245,"And if that happens, obviously, then you'll see a decline in the microarray line"
246,But that's really good news for customers and their customers because that means they are getting more value from the sequencing
247,And it's obviously terrific news for us at Illumina
248,"It's hard to predict, we're already seeing sequencing in the ag market, for example, and that's already starting to play out"
249,"So it's hard to know how much of this microarray demand will move to sequencing over time, and obviously, we're going to do everything we can to encourage that"
250,And then the same thing on the DTC side
251,It's hard to predict if and when those markets will move to sequencing
252,"And when that happens, obviously, you'll see microarrays come down and you'll see sequencing go up, which again is terrific for us"
253,So it's hard to call a specific run rate
254,"I mean, we've been on the market now for â€"
255,"“ it's two quarters, not fully quite three quarters yet, and each one of them has had their own dynamic"
256,"Obviously, there was the launch quarter"
257,There was a quarter when we were constrained by manufacturing
258,And this is the first quarter we are exiting without being constrained by manufacturing
259,And so I don't think we're at the stage yet
260,where we can call an order run rate
261,"I will say, though, that, as we looked â€“ coming into this year, we looked at the curves, the order curves by quarter for some of our previous instruments, including the X"
262,And what we're seeing with NovaSeq is consistent with what we saw with the X
263,"So, at this stage, it's not yet at the regular run rate basis, but the curves are similar to what we've seen before"
264,"It'll take a few more quarters, I think, before we get to a steady state of orders per quarter"
265,"Look, we believe that prior authorization will add friction into the market as a whole"
266,"And so, over time, that's something we want to help the industry work through"
267,It hasn't showed up in terms of impacting our demand at this stage
268,"And when I talked about the growth in the clinical market, one element certainly was the translational liquid biopsy studies that are going on"
269,But we talked about the growth we're seeing in oncology testing as a whole even beyond liquid biopsies
270,We talked about the growth that we're seeing in NIPT in terms of the covered lives continuing to expand both here and internationally
271,"And so there are a number of factors that are driving that 35% growth, not just the large liquid biopsy studies"
272,Yeah
273,"I'll start by saying that I saw some of those things at ASHG too, and I think it is exciting to see the momentum that's building around the value of whole genome sequencing"
274,"I was talking to a customer at ASHG who said, look, it's clear to them that even if you wanted to do the best exome you could, the way you do it is you do a whole genome because you actually would find variance that you wouldn't find if you did whole exome sequencing, which is an interesting conversation"
275,"And I think from our perspective, it's exciting to see the momentum building around whole genome sequencing"
276,"From a $100 a genome perspective, we continue to believe that that is attainable with the architecture that we have in NovaSeq"
277,"It is a multiyear goal, but we have line of sight into the technology improvements that get us from here to there"
278,"The thing that we are also working on then is trying to catalyze the sequencing intensive application demand so that we can continue to drive prices down, and it will be met with a demand that will be overall additive to the market size"
279,"And so we have work going on from a technology perspective to enable that, but the rate at which we step the price down will be equally informed by our belief that the elasticity of the market is there to extend it at each price point that we take down"
280,"We think that S4 for customers that reach the highest volumes do give you access to prices that are lower than you would have got with the X, and we believe that the market is ready for that"
281,"And so we think the elasticity is there by taking the prices per gene and therefore the prices per genome down below the X, it overall expands the market"
282,So that's the first step towards the $100 genome as we put out S4 right now
283,"And we'll continue to step it down knowing that we can get there with this architecture, but it will be gated somewhat by in our belief that the market is there at any given point for the price point we put out"
284,"So the â€“ sorry, the question you're saying is that â€“ let me make sure I understand it"
285,"So you're saying, look, if you look at the high throughput part of the portfolio, what is the dynamic that plays out as they move to NovaSeq?"
286,Is that the question that you're asking?
287,Yeah
288,So there are a number of things that are going to play out
289,"One thing that we believe with NovaSeq is that it will push the elasticity of the market and that, by enabling customers to have access to lower price points, they will go after larger cohorts"
290,"So, if you are a high-throughput customer, if you are an X customer, for example, you will look to do larger experiments"
291,You will look to do single-cell experiments
292,You will look to do liquid biopsy experiments
293,"And some of those you couldn't do on the X, by the way, because it was constrained to whole genomes, right?"
294,"And so, one thing that I think will drive elasticity"
295,"â€“ sorry, utilization beyond just moving your workloads from an X, for example, to NovaSeq is that part of that transition for a number of our customers includes a contemplation of workloads that they wouldn't do before without a NovaSeq"
296,And that's true whether you're an X customer moving to NovaSeq or a 2500 customer moving NovaSeq
297,"As we think about the market, we think sort of overall we talked about the fact that utilization is in the 50-ish-percent and has been sort of approaching that now for a number of years and fairly stable"
298,"And so we're never designing to say, look, we want to have them running at 80%, 90%"
299,"And if that's happening, it would indicate to us maybe that there was too much centralization of the market"
300,And so the other dynamic that NovaSeq enables in the market is it democratizes access to high-throughput sequencing
301,"And so you're seeing customers that were outsourcing a lot of their samples in some cases, and they're looking to move those in-house"
302,And so the other dynamic the we're targeting with NovaSeq is to democratize access to high-throughput sequencing
303,Yeah
304,I think â€
305,"“ so when we talked about the HiSeq sequencing consumables, we said, look, that the â€“ we expect that to go down over time"
306,And the dynamic we saw play out last quarter
307,"was we had these large clinical commercial customers that were seeing growth in their business, and that drove the demand for HiSeq consumables last quarter that resulted in overall HiSeq consumables growing"
308,"We expect that to be a temporal dynamic, and we expect that over time there will be a cut-over"
309,"Now, the validation point â€“ with every customer, the validation of NovaSeq is unique to them"
310,And one customer was telling me in two days they were ready to go
311,"In other customer cases, it could take months for them to do the validations they need"
312,And it's driven a little bit by whether they're a research customer or a clinical customer
313,But it's very much driven by the practices of that lab
314,That I think is not going be the gating factor of how the HiSeq consumable bucket changes
315,I think it's going be driven by the dynamics of their business
316,"And so, if you have customers that have large experiments that are running or that have extensive validation practices, that will determine how quickly they move over"
