,Sentences
213,"But the other aspect as you know is related to what their strategy is, do we want to put more capital and increasing more complicated area, and in some cases they decide not to"
214,"Second is they realize that our scale is significant and as we move away from a fee-for-service model to a much more value based reimbursement model, it's still longer to be in activity, it's going to be making sure we have the best cost per service unit and our cost structure is far superior than any other cost structure"
215,"So, in many of the cases we are engaged around this and"
216,"in some cases where we have bought their [indiscernible] business, it's because they see reimbursement changing and they believe that they have to move to team up with someone like Quest that has a very efficient model delivering the necessary diagnostic services, so as part of that overall strategy for the integrated delivery system, a part of this is looking at pressure and range, but it's more comprehensive than that as well, Issac"
217,"Yes, so we shared this at our Investor Day"
218,"Look at the market we compete in, ourselves and the nearest competitor, less than 25% share"
219,We have a very compelling value proposition where we offer some of the best pricing
220,"and we believe best service and quality on the planet, and we believe we should have more share"
221,We're working hard at gaining that organically
222,but we are also believing that we can consolidate more of this marketplace and that's why we have the strategy of 1% to 2% growth through those strategic [indiscernible] acquisitions
223,"We have announced a number this year with [indiscernible], we're moving forward down with Med Fusion and also we also announced recently [indiscernible] in Massachusetts"
224,So our march continues to drive that strategy
225,So we think the commercial rate pressure on the rest of the marketplace will help accelerate the strategy we are on and we should over time take up more share both organically and through acquisitions
226,"I can't handicap it, but I will share that we are actively working the communication with CMS, and when I say we, it's the Board of Directors and all members of ACLA are actively talking to our Congress members both on House side as well as the Senate side"
227,We have also met a couple of times with the leadership at CMS
228,"The leadership at CMS understands this well, understands that the current approach has issues associated with it, and our simple messaging on this is take the time to get it right"
229,We continue to support the idea of paying or having CMS pay market-based pricing
230,"To get the right data, take the right approach to bringing on those rates is important for all of us"
231,And what we remind them of is the reason why we have PAMA
232,"is reflective of the work that's to protect access to Medicare Act, and it's important for Congress"
233,and it's part of their congressional [intent]
234,"[ph] not to just pay at the lowest rates but to make sure that they pay for what they use, and the reason for this is there's many parts of this country that are not served by the large national laboratories"
235,"And the concern that they are now aware of is if in fact, if this is not done in the right way, rates could be cut, smaller labs that are very necessary in smaller rural areas, in some segment of the marketplace"
236,"the majority of what the testing is has provided the Medicare marketplace could be substantially cut, and the example of that is what's happening in nursing homes where a majority of their single testing is basically the most routine tests that are done for many small laboratories all over this country"
237,So we remind Congress and we remind CMS of where we started and why we believe paying market based price is quite important
238,"So, what I'll share is we think they are very, very responsive to listening to our concerns"
239,We realize there is an element of administration
240,They realize that what was put in place was put in place over the last couple of years
241,They realize there is an opportunity to work with us to get it right
242,So we remain hopeful
243,but I can't handicap it
244,"We have been at a point where we don't have the capacity to do deals that make sense and we spend a lot of time looking at deals, we say no to more deals than we say yes to"
245,It's important
246,We continue to go back to our philosophy on doing acquisitions
247,They have to be strategically aligned and also we have to make money on those deals
248,And a key part of making money on those deals is making sure we have the right integration plan
249,"And so, as we integrate this, we have a small structural team that helps us with the integration but also a large part of the integration happens in our regions as well"
250,"And so, if you look at the distribution of some of these deals, they have been distributed throughout the United States"
251,We have done a number up in the north
252,"[Indiscernible] being one example of that, Harvard Health Care being another example, but most recently we are doing this deal out in our western region with PeaceHealth"
253,and we are working on that with enough capacity to pull that off
254,"So, our capacity has not been [indiscernible] at all"
255,It's more the [indiscernible] factor to making sure we have deals that we believe are strategically aligned and we could make money on
256,I appreciate that
257,"First of all, the relationship is getting nowhere near"
258,"We said we are going to focus on two largest states, Florida and Texas, and we're going to pick 15 sites that will be our initial pilot sites"
259,"And what we'll provide at those sites are some of our patient service center capabilities like we've done with Safeway, but we believe there's more we could do on those sites with basic healthcare services"
260,"And what will specifically get done is really dependent upon where we forge relationships with healthcare insurance companies, their integrated delivery systems for ACOs within those geographies where we think there could be some value of providing with basic healthcare services in those great access points that Walmart has"
261,This will be a joint venture
262,We are the majority holder of ownership in that joint venture
263,"We have not provided visibility or guidance of how large this will be, but we are hopeful that this year we'll be off to a good start and we'll share more in due course as we get into it"
264,"The second part of your question, as we said when we announced Safeway, Safeway was an excellent relationship"
265,We are proud of what we have done
266,"We are half way into what fully we can realize, about 100 stores, we've got another 100 to go to get to 200."
267,What we are doing with Walmart we think is complementary and every one of the retail strategies that are – retail companies that are in our space have a different strategy
268,So we continue to enjoy a nice good working relationship with [CBS]
269,[ph]
270,[indiscernible]
271,We believe Walgreens has a different strategy as well
272,"And what we will do is – Walmart and what we will do with Safeway, we believe there are other ways we could work with other retailers that could be complementary to what we agree to do with these two that we have announced so far"
273,We are working our way through that
274,The Safeway relationship is different than what we're going to do at Walmart
275,and we already have working relationships with some other retailers
276,"I mentioned CBS and Walgreens, different strategies, all these have different strategies"
277,"And frankly, I think we'd like to have a handful of strong national brands that we work with"
278,We'd like to make some progress with those before we expand too broadly
279,So we have two now and working relationships with others
280,"So, we are totally focused on executing against what we've said we would do with Safeway"
281,We feel good about that
282,We just launched this new relationship with Walmart
283,We want to make sure we make progress in 2017.
284,"And as far as others, in due course we will talk about that as we work with them on their own trend, [indiscernible] how we could be helpful, but a good way of thinking about this, we started with one, we've now moved to two and a handful will be a good number that we could then manage over time to provide what we do and help them with their health strategy"
285,So we are open to working with others
286,We want to make sure that what we do doesn't in any way contradict what we are doing with some other partners
287,"But as you know, Walgreens continues to broaden their health presence"
288,They have a working relationship as you know with Med Express
289,Med Express will provide healthcare services and that strategy will change over time
290,"And as you know, most of these retailers work with all different brands, no matter what category and laboratory services are going to be different"
291,"So, they are selling all different bands in their stores, so therefore they are open to different brands and we believe that this strategy is good for us to think about how we could team up with different people in the ecosystem in healthcare and every one of these players has different strategy"
292,"So, we think there is an opportunity here as well"
293,"Okay, so that concludes our day"
294,We had a strong first half in 2017.
295,"We look forward to continue to meet our commitments by executing our two-point strategy, which is to accelerate growth and drive operational excellence"
296,We appreciate your time on this call and we hope you have a great day
