,Sentences
252,"So whether that is way finding through a large big box retail environment, whether that is way finding through a hospital, this is a very important application that rides on top of Aruba"
253,The other thing is asset tagging
254,"If you think about a hospital environment, where are-"
255,most of their assets are mobile and at the end of everyday they are never where they are supposed to be and the ability to asset tag and work to the wireless network has been a big selling point for a number of different customers
256,"So, listen, we compete hard every day there"
257,But it is a very rapidly growing market and we are gaining share in the campus branch and edge
258,"So, listen, we expect that to continue"
259,"I think that the Aruba team would also tell you they have benefited by part of being a part of Hewlett Packard, because when they were Aruba people loved the product, but some big companies were a little bit hesitant to sign on to a small independent start-up while part of HPE, they know we will stand behind Aruba and that has totally helped the revenue trajectory of Aruba"
260,"So listen, we remain optimistic and they have a fantastic product, well priced with an excellent sales force with terrific white glove service and"
261,that’s another differentiator
262,"Yes, so listen, we think HPE Next will have positive revenue accelerators and it really goes to two major initiatives, one is how do we make decisions on accountability much closer to the customer"
263,So that frontline sales executives can make the decisions in the field faster
264,"And that by increasing the agility and the decision-making, I think actually, we will do more business"
265,Another case on revenue acceleration is our ability to quote configurations much faster
266,"We’ve made progress on this over the last several years, but we need to make more progress"
267,"And how we change our pricing and our quoting to be much more customer-focused and customer-friendly, I think is an important element for us"
268,"If you think about reducing the number of SKUs and options, this also makes it easier to sell, and faster to configure on offering"
269,and I think that will accelerate
270,"And then I mentioned, probably like most companies, a small number of countries account for the vast majority of revenue and profit and will account for the growth in our industry over the next five to ten years"
271,and we want to make sure we are allocating the resources correctly to the largest countries with the countries that have the most growth and profit potential for us
272,"And so, I think that actually will accelerate"
273,As you can imagine a 1% increase in the United States dwarf just about if you think of the long tail of countries that dwarfs the revenue in those long tail of countries
274,So those are some of the initiatives that I think by extension will impact revenue to the positive
275,"So, we are very focused on"
276,", how do we be simpler to the business with, faster to the business with, which should result in revenue increases"
277,"We do, actually we really do"
278,We aim to go into FY 2018 with a clean sheet operating model in a way that I hope customers will see a difference right away
279,and frankly it would be easier for our employees to get things done
280,"If you think about what was required to hold this company together when it was a very large multi-business company, some of those ways of doing business, we need to let go off"
281,"And I understand why it was here, it was necessary in terms of growing together such a large company, but now that we are more focused with a focused strategy and a smaller company, I think we can do better in terms of making it easier for our employees to get things done"
282,Thank you very much
